{
  "schema_version": "1.0",
  "generated_at": "2026-09-26T07:45:26.293015Z",
  "currency": "JPY",
  "benchmark": {
    "name": "eMAXIS Slim全世界株式（オール・カントリー）",
    "source": "三菱UFJアセットマネジメント eMAXIS Slim全世界株式（オール・カントリー）基準価額（分配金実績なし、信託報酬控除後）",
    "retrieved_on": "2026-09-26",
    "annual_fee": 0.0
  },
  "definitions": {
    "criteria": "税引き後CAGRとSharpe比の両方がベンチマークを上回ること（全期間で必須）",
    "month_boundary": "Asia/Tokyo",
    "ea_monthly_return": "決済済み取引損益（手数料・スワップ込み）÷月初の実現残高。複数ケースは損益を1口座へ合算",
    "benchmark_monthly_return": "月末値の変化率から信託報酬（年率）を月割りで控除",
    "ea_tax": "暦年ごとの純利益へ0.20315、損失は翌年以降3年間繰越控除",
    "benchmark_tax": "期間末に全額売却したものとして譲渡益へ0.20315",
    "sharpe": "税引き前の月次収益率、リスクフリーレート0、標本標準偏差、年率化係数sqrt(12)"
  },
  "periods": [
    {
      "label": "WalkForward",
      "start_month": "2020-01",
      "end_month": "2024-12",
      "initial_balance": 1000000.0,
      "number_of_trades": 521,
      "ea": {
        "months": 60,
        "pre_tax_cagr": 0.0317959202200957,
        "after_tax_cagr": 0.025140844094024395,
        "after_tax_ending_multiple": 1.1321857541761697,
        "total_tax": 0.03543503778385611,
        "sharpe_ratio": 0.6412931403561969
      },
      "benchmark": {
        "months": 60,
        "pre_tax_cagr": 0.1872659774506289,
        "after_tax_cagr": 0.15807498220673422,
        "after_tax_ending_multiple": 2.082971838786641,
        "total_tax": 0.276094282549421,
        "sharpe_ratio": 1.1469286698498664
      },
      "ea_tax_years": [
        {
          "year": 2020,
          "pre_tax_return": 0.04155499999999979,
          "wealth_start": 1.0,
          "gain": 0.04155499999999979,
          "carryforward_used": 0.0,
          "taxable_income": 0.04155499999999979,
          "tax": 0.008441898249999956,
          "wealth_end": 1.03311310175,
          "carryforward_remaining": []
        },
        {
          "year": 2021,
          "pre_tax_return": 0.05775019082045585,
          "wealth_start": 1.03311310175,
          "gain": 0.05966247876517552,
          "carryforward_used": 0.0,
          "taxable_income": 0.05966247876517552,
          "tax": 0.012120432561145407,
          "wealth_end": 1.08065514795403,
          "carryforward_remaining": []
        },
        {
          "year": 2022,
          "pre_tax_return": 0.05944240971948056,
          "wealth_start": 1.08065514795403,
          "gain": 0.06423674607014934,
          "carryforward_used": 0.0,
          "taxable_income": 0.06423674607014934,
          "tax": 0.013049694964150838,
          "wealth_end": 1.1318421990600287,
          "carryforward_remaining": []
        },
        {
          "year": 2023,
          "pre_tax_return": 0.00792842314852793,
          "wealth_start": 1.1318421990600287,
          "gain": 0.008973723891508288,
          "carryforward_used": 0.0,
          "taxable_income": 0.008973723891508288,
          "tax": 0.0018230120085599088,
          "wealth_end": 1.138992910942977,
          "carryforward_remaining": []
        },
        {
          "year": 2024,
          "pre_tax_return": -0.005976469828220088,
          "wealth_start": 1.138992910942977,
          "gain": -0.006807156766807272,
          "carryforward_used": 0.0,
          "taxable_income": 0.0,
          "tax": 0.0,
          "wealth_end": 1.1321857541761697,
          "carryforward_remaining": [
            {
              "origin_year": 2024,
              "loss": 0.006807156766807272
            }
          ]
        }
      ],
      "ea_monthly_returns": [
        {
          "month": "2020-01",
          "return_rate": -0.010322
        },
        {
          "month": "2020-02",
          "return_rate": 0.03485982309397602
        },
        {
          "month": "2020-03",
          "return_rate": 0.00261185067439449
        },
        {
          "month": "2020-04",
          "return_rate": -0.0039781740911308625
        },
        {
          "month": "2020-05",
          "return_rate": 0.029342920388592524
        },
        {
          "month": "2020-06",
          "return_rate": -0.03018962194344682
        },
        {
          "month": "2020-07",
          "return_rate": 0.01198143773335057
        },
        {
          "month": "2020-08",
          "return_rate": 0.01948841931459531
        },
        {
          "month": "2020-09",
          "return_rate": 0.00929877108124914
        },
        {
          "month": "2020-10",
          "return_rate": 0.0029788554874148766
        },
        {
          "month": "2020-11",
          "return_rate": -0.008880953028480007
        },
        {
          "month": "2020-12",
          "return_rate": -0.014478780005241958
        },
        {
          "month": "2021-01",
          "return_rate": -0.0018001929806875296
        },
        {
          "month": "2021-02",
          "return_rate": -0.0013985072329947676
        },
        {
          "month": "2021-03",
          "return_rate": 0.009675157432004207
        },
        {
          "month": "2021-04",
          "return_rate": -0.017117710973593662
        },
        {
          "month": "2021-05",
          "return_rate": 0.021361179509029656
        },
        {
          "month": "2021-06",
          "return_rate": 0.012233735232853385
        },
        {
          "month": "2021-07",
          "return_rate": -0.0034960242581275054
        },
        {
          "month": "2021-08",
          "return_rate": 0.009233282398448967
        },
        {
          "month": "2021-09",
          "return_rate": -0.0129899830764305
        },
        {
          "month": "2021-10",
          "return_rate": -0.0017477309288792676
        },
        {
          "month": "2021-11",
          "return_rate": 0.037970750045238234
        },
        {
          "month": "2021-12",
          "return_rate": 0.005570453504100942
        },
        {
          "month": "2022-01",
          "return_rate": -0.012248287881057088
        },
        {
          "month": "2022-02",
          "return_rate": -0.01292580207331115
        },
        {
          "month": "2022-03",
          "return_rate": 0.023573167496008452
        },
        {
          "month": "2022-04",
          "return_rate": 0.006068400478050254
        },
        {
          "month": "2022-05",
          "return_rate": -0.003710206140644296
        },
        {
          "month": "2022-06",
          "return_rate": 0.030244983367119345
        },
        {
          "month": "2022-07",
          "return_rate": 0.004868038031822366
        },
        {
          "month": "2022-08",
          "return_rate": -0.0007800913671057383
        },
        {
          "month": "2022-09",
          "return_rate": -0.0016412251908329986
        },
        {
          "month": "2022-10",
          "return_rate": 0.03048682445166681
        },
        {
          "month": "2022-11",
          "return_rate": -0.013319077205628442
        },
        {
          "month": "2022-12",
          "return_rate": 0.008628526591589412
        },
        {
          "month": "2023-01",
          "return_rate": -0.002569412256584815
        },
        {
          "month": "2023-02",
          "return_rate": -0.013996808092122103
        },
        {
          "month": "2023-03",
          "return_rate": -0.010961765799952783
        },
        {
          "month": "2023-04",
          "return_rate": 0.0019527602887654187
        },
        {
          "month": "2023-05",
          "return_rate": 0.014316068193186484
        },
        {
          "month": "2023-06",
          "return_rate": 0.014621023419638106
        },
        {
          "month": "2023-07",
          "return_rate": -0.006454324294773672
        },
        {
          "month": "2023-08",
          "return_rate": 0.00250272540004058
        },
        {
          "month": "2023-09",
          "return_rate": 0.010836650106385442
        },
        {
          "month": "2023-10",
          "return_rate": 0.02325739238588284
        },
        {
          "month": "2023-11",
          "return_rate": -0.011884665514736853
        },
        {
          "month": "2023-12",
          "return_rate": -0.012847406939999563
        },
        {
          "month": "2024-01",
          "return_rate": -0.010562311774351076
        },
        {
          "month": "2024-02",
          "return_rate": -0.00016494547778777186
        },
        {
          "month": "2024-03",
          "return_rate": 0.005960497633243371
        },
        {
          "month": "2024-04",
          "return_rate": -0.001572474772926443
        },
        {
          "month": "2024-05",
          "return_rate": -0.008321320871741129
        },
        {
          "month": "2024-06",
          "return_rate": -0.00273637463142621
        },
        {
          "month": "2024-07",
          "return_rate": 0.0074012176196729135
        },
        {
          "month": "2024-08",
          "return_rate": 0.0018161022581492758
        },
        {
          "month": "2024-09",
          "return_rate": 0.03162089214251858
        },
        {
          "month": "2024-10",
          "return_rate": -0.009740035842800159
        },
        {
          "month": "2024-11",
          "return_rate": -0.012938535036656805
        },
        {
          "month": "2024-12",
          "return_rate": -0.0059747799514639445
        }
      ],
      "benchmark_monthly_returns": [
        {
          "month": "2020-01",
          "return_rate": -0.005879345603271968
        },
        {
          "month": "2020-02",
          "return_rate": -0.0749121453672752
        },
        {
          "month": "2020-03",
          "return_rate": -0.15037524321319373
        },
        {
          "month": "2020-04",
          "return_rate": 0.09269356597600864
        },
        {
          "month": "2020-05",
          "return_rate": 0.041017964071856206
        },
        {
          "month": "2020-06",
          "return_rate": 0.024925702233726366
        },
        {